{
    "name": "sample-mbdirector-benchmark",
    "configuration": {
        "memtier_benchmark": {
            "binary": "../memtier_benchmark/memtier_benchmark",
            "threads": 1,
            "clients": 10,
            "test_time": 5
        }
    },
    "targets": [
        {
            "name": "redis-no-aof",
            "binary": "../redis/src/redis-server",
            "args": []
        },
        {
            "name": "redis-aof-fsync-always",
            "binary": "../redis/src/redis-server",
            "args": ["--appendonly", "yes", "--appendfsync", "always"]
        }
    ],
    "benchmarks": [
        {
            "name": "small-100b-values",
            "args": ["--data-size", "100"]
        },
        {
            "name": "large-4k-values",
            "args": ["--data-size", "4000"]
        }
    ]
}
